<?xml version="1.0" encoding="UTF-8" standalone="no" ?>
<!DOCTYPE function SYSTEM "qtfmfunction.dtd">
<function name = "mean" overload = "both">
<short>Average or mean value</short>
<syntax>Y = mean(X, dim)</syntax>
<long>
<para>
<code>mean(X, dim)</code> computes the mean values of the elements of the
quaternion or octonion array <code>X</code> along dimension <code>dim</code>. If
omitted, <code>dim</code> defaults to the columns of <code>X</code>.
</para>
</long>
<examples>
<precode>
>> mean([qi, qj, qk])
 
ans = 0.3333 * I + 0.3333 * J + 0.3333 * K
</precode>
</examples>
<seealso>
<matlabfun name = "mean"/>
</seealso>
</function>

<!--$Id: mean.xml 1004 2017-11-15 17:14:09Z sangwine $-->
