<?xml version="1.0" encoding="UTF-8" standalone="no" ?>
<!DOCTYPE function SYSTEM "qtfmfunction.dtd">
<function name = "cos" overload = "true">
<short>Cosine</short>
<syntax>Y = cos(X)</syntax>
<long>
<para>
<code>cos(X)</code> computes the cosine of the quaternion argument <code>X</code>
which may be a complexified quaternion.
</para>
</long>
<examples>
<precode>
>> cos(1 + qi)
 
ans = 0.8337 - 0.9889 * I + 0 * J + 0 * K
</precode>
</examples>
<seealso>
<matlabfun name = "cos"/>
<qtfmfun name = "sin"/>
</seealso>
</function>

<!--$Id: cos.xml 1004 2017-11-15 17:14:09Z sangwine $-->
